{
  "schemaVersion": 1,
  "manifestId": "docwen-windows-production",
  "product": {
    "name": "DocWen",
    "version": "0.21.1",
    "stableSemverOnly": true,
    "cliJsonProtocolVersion": 3,
    "releaseTagFormat": "{version}"
  },
  "target": {
    "os": "windows",
    "arch": "x86_64",
    "platformTag": "win-x64"
  },
  "sourceContracts": {
    "versionProjectionPaths": [
      "pyproject.toml",
      "packages/core/pyproject.toml",
      "packages/application/pyproject.toml",
      "packages/runtime/pyproject.toml",
      "packages/bundle/pyproject.toml",
      "packages/apps/cli/pyproject.toml",
      "packages/apps/gui/pyproject.toml"
    ],
    "protocol": {
      "path": "packages/apps/cli/src/docwen_cli/protocol.py",
      "sha256": "e9a29d849b6f3f1a2d96d7c61b9650d3ae713c741229bb1e00eb8acf69562e34"
    },
    "schema": {
      "path": "docs/specs/json-contracts.schema.json",
      "sha256": "b02e588b9e329a39c5bdbbe6975fa157f9b4c5e977d8a304291f27ea02c0ae06"
    },
    "fixtures": [
      {
        "path": "tests/fixtures/golden/cli_protocol_v3_success.json",
        "sha256": "2ada7d7f904d73e25c57bce4ccd652bebee38319e344c2e827dc8d91adc253cd"
      },
      {
        "path": "tests/fixtures/golden/cli_protocol_v3_error.json",
        "sha256": "c778c9d26eba3debbb3eb5ec524781084c9eccd5373cd4fe5acd95a52f5f78f4"
      },
      {
        "path": "tests/fixtures/golden/cli_protocol_v3_batch.json",
        "sha256": "695d496ac5334c23fe13932f5be5c7de253b52afd53318dbffeaa8d28c55ec43"
      }
    ],
    "machineContractFiles": [
      {
        "path": "contracts/schemas/docwen.machine.v2.schema.json",
        "sha256": "a816d6b31140746f4cdacbac55aea04e4bc4da6ce9a94225a4da1459b336f26b"
      },
      {
        "path": "contracts/schemas/docwen.machine.diagnostic_evidence.v1.schema.json",
        "sha256": "c9841a755884840ab6c43f8b2b527b138c3f87de31a0c49b0a20ab1a88cbfb2e"
      },
      {
        "path": "contracts/schemas/docwen.artifact_bundle.v3.schema.json",
        "sha256": "5f03cd1cdb89e1b8f3852642ea61f387b49b3ca7063256305104b0806e644a68"
      },
      {
        "path": "contracts/schemas/docwen.proofread_report.v2.schema.json",
        "sha256": "ff5bd9e88c3a34ea15f05fa0d4a2b49136013ca0f4074fb0600eb560ea98a8b4"
      },
      {
        "path": "contracts/schemas/docwen.semantic_bibliography.v1.schema.json",
        "sha256": "fdb25f27fc750f683aea9f6b7364437e8e0b832fa7d03f45b531bc938832b373"
      },
      {
        "path": "contracts/conformance-manifest.json",
        "sha256": "6e3e177fa7ccd795f3c0dad1204073c7c7a552e0ffeb9c732c3252c3a5b14041"
      },
      {
        "path": "contracts/fixtures/invalid/machine.legacy-bundle-producer.trace.json",
        "sha256": "8d5b2bc42e5d8a4be3368341c478fb76b4b2a9db534f7d0c296f10fcd4a45685"
      },
      {
        "path": "contracts/fixtures/valid/machine.templates.response.json",
        "sha256": "629e5ca231f17dd18e6b307762e61a6873d229e84d18f63ac84be36c58df3d60"
      },
      {
        "path": "contracts/fixtures/invalid/machine.templates.missing-origin.json",
        "sha256": "ab48a1379533457d323980cd865c779fddb9e7a9eb70fd75e2eecaf367490649"
      },
      {
        "path": "contracts/fixtures/invalid/machine.templates.missing-is-default.json",
        "sha256": "0a6b84b4688a3833d4442fa3e69fb1170907bfade2679e913f68e57f904848b7"
      },
      {
        "path": "contracts/fixtures/invalid/machine.templates.invalid-origin.json",
        "sha256": "8600be8cd7b897bd22e67e269905af0bba8c98ca6060979a71ac703c3fcbd7da"
      },
      {
        "path": "contracts/fixtures/invalid/machine.templates.invalid-is-default.json",
        "sha256": "d779ee7662ff6d75c53e56c9d2f68a7d239ce7e55926a5bf7c368c132d8bb8d5"
      },
      {
        "path": "contracts/fixtures/invalid/machine.templates.invalid-id.json",
        "sha256": "cbaba90fd2aa6807aa0eb94a1401797f3ac8ff47dcddf21dbe8f12bb28b205b9"
      },
      {
        "path": "contracts/fixtures/invalid/machine.templates.invalid-target.json",
        "sha256": "f473ccd778ec995d268ccbaab6fa09a2d0bbb9e01b5ab8339d46ee4c2e449a64"
      },
      {
        "path": "contracts/fixtures/invalid/machine.templates.invalid-path.json",
        "sha256": "d1fde7e039f0cc69b41e915c786e884a38077850dca38e2a40f12d7ad5539a37"
      },
      {
        "path": "contracts/fixtures/invalid/machine.initialize.legacy-major.json",
        "sha256": "5c9d47116b05e8aa5de4a23b1630cf2ba784a008124b2f7e0102f0f30585a233"
      },
      {
        "path": "contracts/fixtures/invalid/machine.initialize.future-minor.json",
        "sha256": "0f9384608e14a55aa51a0b24e968d3dc78e8bdff26e12ee031a537e741ec5791"
      },
      {
        "path": "contracts/fixtures/valid/semantic-bibliography.rich.json",
        "sha256": "0131cd535a3b7757daf282b2f89e18ac641cf00e63b8d754383ca80f27aefccd"
      },
      {
        "path": "contracts/fixtures/invalid/semantic-bibliography.unknown-field.json",
        "sha256": "2e4514d52bc4805db6931a9602ae1272bfc52dce2833a701901c7a62be02d67e"
      },
      {
        "path": "contracts/fixtures/valid/machine.capability-list.response.json",
        "sha256": "7d5d39866a2f43b52876ea091a21c41ecff51c1b2082a3d49155c3ab909abfdc"
      },
      {
        "path": "contracts/fixtures/valid/machine.task-lifecycle.trace.json",
        "sha256": "c2519f51da0acff35dedba1f8a10484c279c74f58a2a38f5bb92813cf110d0df"
      },
      {
        "path": "contracts/fixtures/valid/machine.v4-diagnostic-evidence.trace.json",
        "sha256": "7bddf90e17ec7bb111f25b2652de18360095ffa27e4a6bf90d0b162f9e1f3532"
      },
      {
        "path": "contracts/fixtures/valid/artifact-bundle.ocr.json",
        "sha256": "47e9b6fc5f1ae1405e39e114de4a16d9fc492d20dad331a6eacd4588bd320f25"
      },
      {
        "path": "contracts/fixtures/invalid/artifact-bundle.missing-page-fragment-semantics.json",
        "sha256": "28f646fe6c6de9ae067a22b126e3b2ba2116b463ac853b5c8421fb573436eb50"
      },
      {
        "path": "contracts/fixtures/invalid/artifact-bundle.unexpected-page-semantics.json",
        "sha256": "c54797feaedc5b87a537b828239a675acea3bfaad2ceb9fe516cc214ab085a2b"
      },
      {
        "path": "contracts/fixtures/invalid/artifact-bundle.invalid-page-range.json",
        "sha256": "3810931f2f735816d76e0fce4bb9fa1c140a5f1d746431651d2041d5e3b1ad9f"
      },
      {
        "path": "contracts/fixtures/invalid/artifact-bundle.page-ordinal-mismatch.json",
        "sha256": "799eae572ce3befe9a8b24b1ef93cf41f37a8248b8b8951866a08751c8ff82bc"
      },
      {
        "path": "contracts/fixtures/invalid/artifact-bundle.page-count-mismatch.json",
        "sha256": "4ffe9dd7da7a73e60101ec16c9344fd22d5496cc1fd9ec3cbd3550e826bc37f0"
      },
      {
        "path": "contracts/fixtures/invalid/artifact-bundle.duplicate-page-index.json",
        "sha256": "d154d118d9a375077f27f8c3c4d5c76a864ec446365093fd194c6077b9cb94bf"
      },
      {
        "path": "contracts/fixtures/invalid/artifact-bundle.incomplete-page-sequence.json",
        "sha256": "dd1ba3dd405864e70b28e4ee527858d4cff438673d2fd26b8dc40de7be5d32e3"
      },
      {
        "path": "contracts/fixtures/invalid/artifact-bundle.page-source-mismatch.json",
        "sha256": "dce916064fe6157bdc6971f3de47b3f502264c77b0d0adfcc20d35f21f323372"
      },
      {
        "path": "contracts/fixtures/invalid/artifact-bundle.resource-page-mismatch.json",
        "sha256": "5f953ae3984e4f6c4b806ed0e5a332827a944eb25423da640fed54e65b8e54b5"
      },
      {
        "path": "contracts/fixtures/invalid/artifact-bundle.page-semantics-unknown-field.json",
        "sha256": "6455a923c3fc3cba61500499eb5157376b80c263bfe741856d93d26e3b4886ee"
      },
      {
        "path": "contracts/fixtures/invalid/artifact-bundle.duplicate-relation-ordinal.json",
        "sha256": "0d613dd8be4beb7228e1159b6b1ff2c8e94116264b6f4a769ae8c7c00437881b"
      },
      {
        "path": "contracts/fixtures/invalid/machine.dangling-diagnostic-artifact.trace.json",
        "sha256": "6a5a2eb596129b472b1b2a94cf1ff5faa298ffe9a4e60cc2e03094bdc57602de"
      },
      {
        "path": "contracts/fixtures/invalid/machine.partial-diagnostic-evidence.json",
        "sha256": "ff411ade8d306c09fa8e11665ea7183c5172ff8b6fceb920fc5409497897486a"
      },
      {
        "path": "contracts/fixtures/invalid/machine.duplicate-input-logical-path.trace.json",
        "sha256": "011e84a387f1634914611ac3b50a4f51fe80c1e1861a15e06807603aa6a9bf9c"
      },
      {
        "path": "contracts/fixtures/invalid/machine.input-slot-cardinality-mismatch.trace.json",
        "sha256": "92553ec72ac3e9022bffc64f309a221a89d153acd03ee39c0d118be9b89158e4"
      },
      {
        "path": "contracts/fixtures/invalid/machine.input-slot-kind-mismatch.trace.json",
        "sha256": "d68c2d7d720580b45eab1750eac1ad2d17d3da5eca734d99433f1f718f299112"
      },
      {
        "path": "contracts/fixtures/invalid/machine.input-slot-media-type-mismatch.trace.json",
        "sha256": "759460636d051d13e052473c3903ae78dee6b9c36a2b7857438189c50ac922cc"
      },
      {
        "path": "contracts/fixtures/invalid/machine.invalid-input-logical-path.trace.json",
        "sha256": "1d0cc728a80d45de62799d2dd404e9873be465b28a03fa93b39fd6faedb6845a"
      },
      {
        "path": "contracts/fixtures/invalid/machine.undeclared-input-role.trace.json",
        "sha256": "d2badf1390584df8b7a226d287d887fb9950cc2a4ba8a3cb216df6f7df74a1a8"
      }
    ]
  },
  "build": {
    "mode": "pure-python",
    "entry": "scripts/release/build_production_candidate.py",
    "primitive": "scripts/build/build.py",
    "network": "offline",
    "sourceMustBeClean": true,
    "outputsMustBeOutsideSource": true,
    "environment": {
      "PYTHONHASHSEED": "0",
      "TZ": "UTC",
      "DOCWEN_GUI_DISABLE_STATE_SAVE": "1"
    },
    "reproducibilityEpoch": 1704067200
  },
  "toolchain": {
    "python": {
      "implementation": "CPython",
      "fullVersion": "3.12.13",
      "arch": "x86_64",